{
  "meta": {
    "version": 1,
    "last_updated": "2026-04-12",
    "title": "SprintView: Dependencies blank for Sprint 2 & 3 due to schema field mismatch",
    "owner": "vibe-qa-general"
  },
  "quick_facts": {
    "bug_id": "BUG-0001",
    "severity": "medium",
    "status": "fixed",
    "sprint": "1"
  },
  "content": {
    "tldr": "SprintView was only reading content.dependencies to populate the 'Dependencies' section. Sprint 2 and Sprint 3 JSON files use content.prerequisites instead, causing that section to render blank for those sprints.",
    "environment": "wiki-app (Next.js) — sprint detail view for any sprint using 'prerequisites' key",
    "steps_to_reproduce": [
      "Open the wiki-app in a browser.",
      "Navigate to Plan → Sprint 2 (or Sprint 3).",
      "Observe that the 'Dependencies' section is absent / empty.",
      "Inspect wiki/plan/sprints/sprint-2.json and confirm the field is 'prerequisites', not 'dependencies'."
    ],
    "expected_behavior": "The 'Dependencies' section should list all prerequisite/dependency items for every sprint, regardless of which field name the JSON file uses.",
    "actual_behavior": "The 'Dependencies' section was hidden for Sprint 2 and Sprint 3 because SprintView only read content.dependencies; sprint-2.json and sprint-3.json use content.prerequisites.",
    "root_cause": "Schema inconsistency: sprint-1.json uses 'dependencies' while sprint-2.json and sprint-3.json use 'prerequisites'. SprintView only merged the former, so the latter was silently ignored.",
    "fix_description": "Updated SprintView in wiki-app/components/views/PlanView.tsx to merge both fields:\n  const dependencies = [\n    ...((content.dependencies as string[] | undefined) ?? []),\n    ...((content.prerequisites as string[] | undefined) ?? []),\n  ];\nThis is a backwards-compatible read; all sprint JSON files continue to work unchanged."
  },
  "audit": [
    {
      "version": 1,
      "timestamp": "2026-04-12T00:00:00Z",
      "author": "vibe-qa-general",
      "action": "created",
      "note": "Bug identified: SprintView only read content.dependencies; sprint-2 and sprint-3 use content.prerequisites."
    },
    {
      "version": 2,
      "timestamp": "2026-04-12T00:01:00Z",
      "author": "vibe-backend-general",
      "action": "fixed",
      "note": "SprintView updated to spread both content.dependencies and content.prerequisites into a single array before rendering."
    }
  ]
}
